{
  "policy_version": "klein.trust_policy.v1",
  "policy_id": "klein-test-policy",
  "description": "Test policy for Klein signed-conformance fixtures.",
  "trusted_keys": [
    {
      "key_id": "klein-test-backend-001",
      "public_key_encoding": "base64.raw.ed25519",
      "public_key": "A6EHv/POEL4dcN0Y50vAmWfk1jCbpQ1fHdyGZBJVMbg=",
      "signature_algorithm": "Ed25519",
      "trust_scope": {
        "backend_ids": ["full_simulator"],
        "profile_ids": ["dmf"],
        "profile_versions": ["v1"],
        "manifest_versions": ["klein.run_manifest.v1"]
      },
      "status": "trusted",
      "not_before": null,
      "not_after": null,
      "notes": "Public test key. Not production."
    }
  ],
  "revoked_keys": []
}
