{
  "description": "Registry-backed test policy for Klein signed-conformance fixtures.",
  "policy_id": "klein-test-registry-policy",
  "policy_version": "klein.trust_policy.v1",
  "revoked_keys": [],
  "trusted_keys": [
    {
      "key_id": "klein-test-backend-001",
      "signature_algorithm": "Ed25519",
      "source": "registry",
      "status": "trusted",
      "trust_scope": {
        "backend_ids": ["full_simulator"],
        "manifest_versions": ["klein.run_manifest.v1"],
        "profile_ids": ["dmf"],
        "profile_versions": ["v1"]
      }
    }
  ]
}
